name,price,url,source,rating,reviews,weight_g,original_currency,original_value,standardized_price_inr,price_inr,cleaned_name,price_per_gram,dedup_hash,popularity_score,popularity_rank
Expelite Diwali Chocolate Gift Combo - Best Dryfruits & Chocolates Gift For Diwali Bars,428.0,https://www.flipkart.com/expelite-diwali-chocolate-gift-combo-best-dryfruits-chocolates-bars/p/itmbb0cee87fbb7a,flipkart,,,,INR,428.0,428.0,428.0,Expelite Diwali Chocolate Gift Combo - Best Dryfruits & Chocolates Gift For Diwali Bars,,6bfff6fd5a48d586e4990507a66aefc8,0.0,284
Zoroy Luxury Chocolate Gourmet box of goodies and chocolates Combo,2209.0,https://www.flipkart.com/zoroy-luxury-chocolate-gourmet-box-goodies-chocolates-combo/p/itme7bd74fe466bf,flipkart,,,,INR,2209.0,2209.0,2209.0,Zoroy Luxury Chocolate Gourmet box of goodies and chocolates Combo,,dfe4e053f33c0b88711e4c510ffd2af3,0.0,285
SSKE Chocolate Gift Pack 330g (Pistachio/Almond/Cashew/Caramel Crunch/Vanilla/Dark Chocolate) 30 PCS Combo,411.0,https://www.flipkart.com/sske-chocolate-gift-pack-330g-pistachio-almond-cashew-caramel-crunch-vanilla-dark-chocolate-30-pcs-combo/p/itm79da72e00d6c6,flipkart,,,330.0,INR,411.0,411.0,411.0,SSKE Chocolate Gift Pack 330g (Pistachio/Almond/Cashew/Caramel Crunch/Vanilla/Dark Chocolate) 30 PCS Combo,1.25,e5d4cbbe4b6527f7fe5154c5ed44d334,0.0,286
Midiron Chocolate Gift Hamper | Special Gift Combo for Valentine's Day/Birthday -43 Paper Gift Box,247.0,https://www.flipkart.com/midiron-chocolate-gift-hamper-special-combo-valentine-s-day-birthday-43-paper-box/p/itmfb33e67dfd028,flipkart,,,,INR,247.0,247.0,247.0,Midiron Chocolate Gift Hamper | Gift Combo for Valentine's Day/Birthday -43 Paper Gift Box,,9c43b48fd4442b9f75ebe8469c76ffc7,0.0,287
Midiron Chocolate Gift Hamper for Brother – A Rakhi Surprise with Festive Flavor Assorted Gift Box,554.0,https://www.flipkart.com/midiron-chocolate-gift-hamper-brother-rakhi-surprise-festive-flavor-assorted-box/p/itm6bff079a6e2e5,flipkart,,,,INR,554.0,554.0,554.0,Midiron Chocolate Gift Hamper for Brother – A Rakhi Surprise with Festive Flavor Assorted Gift Box,,29f5aa5449f433c76b81ad55f4f81ac8,0.0,288
Midiron Gift For Birthday Special| Birthday Mug For Couple/Girl|Chocolate Gift Box Ceramic Gift Box,339.0,https://www.flipkart.com/midiron-gift-birthday-special-mug-couple-girl-chocolate-box-ceramic/p/itm6a95b61add494,flipkart,,,,INR,339.0,339.0,339.0,Midiron Gift For Birthday | Birthday Mug For Couple/Girl|Chocolate Gift Box Ceramic Gift Box,,fbd93ab3385afa618284af34f4b6aaf6,0.0,289
Midiron Birthday Chocolate Gift Box| Happy Birthday Gift For Girl/Wife/Fiancee Ceramic Gift Box,342.0,https://www.flipkart.com/midiron-birthday-chocolate-gift-box-happy-girl-wife-fiancee-ceramic-box/p/itmb346e5e26209b,flipkart,,,,INR,342.0,342.0,342.0,Midiron Birthday Chocolate Gift Box| Happy Birthday Gift For Girl/Wife/Fiancee Ceramic Gift Box,,a39fc88b751b037c7b948889eb8d200b,0.0,290
Midiron Birthday Chocolate Gift Box – Perfect Luxury Hamper for Loved Ones Assorted Gift Box,453.0,https://www.flipkart.com/midiron-birthday-chocolate-gift-box-perfect-luxury-hamper-loved-ones-assorted/p/itm1393476e66f7f,flipkart,,,,INR,453.0,453.0,453.0,Midiron Birthday Chocolate Gift Box – Perfect Luxury Hamper for Loved Ones Assorted Gift Box,,4728daffa2c87c02a1a3ada36d9f28a9,0.0,291
Midiron Special Birthday Chocolate Gift Box – Perfect Hamper for Celebration Assorted Gift Box,453.0,https://www.flipkart.com/midiron-special-birthday-chocolate-gift-box-perfect-hamper-celebration-assorted/p/itme039fc010395c,flipkart,,,,INR,453.0,453.0,453.0,Midiron Birthday Chocolate Gift Box – Perfect Hamper for Celebration Assorted Gift Box,,d6e1fc4456452e6942d5c34ce8b39d64,0.0,292
Midiron Premium Diwali Chocolate Hamper – Perfect Celebration Gift for Festive Occasions Assorted Gift Box,581.0,https://www.flipkart.com/midiron-premium-diwali-chocolate-hamper-perfect-celebration-gift-festive-occasions-assorted-box/p/itm0259129782e64,flipkart,,,,INR,581.0,581.0,581.0,Midiron Premium Diwali Chocolate Hamper – Perfect Celebration Gift for Festive Occasions Assorted Gift Box,,928b5e8c15370dc8654d257df2db804a,0.0,293
Midiron Special Diwali Chocolate Collection – Thoughtful Festive Gift for Loved Ones Assorted Gift Box,581.0,https://www.flipkart.com/midiron-special-diwali-chocolate-collection-thoughtful-festive-gift-loved-ones-assorted-box/p/itme584d96b29505,flipkart,,,,INR,581.0,581.0,581.0,Midiron Diwali Chocolate Collection – Thoughtful Festive Gift for Loved Ones Assorted Gift Box,,e81092c349f36797f580f2f42e42f70b,0.0,294
Midiron Soft Red Teddy | Chocolate Gift Hamper | Valentine's Day Gift Hamper | IZ-11 Paper Gift Box,370.0,https://www.flipkart.com/midiron-soft-red-teddy-chocolate-gift-hamper-valentine-s-day-iz-11-paper-box/p/itm80b613e256856,flipkart,,,,INR,370.0,370.0,370.0,Midiron Soft Red Teddy | Chocolate Gift Hamper | Valentine's Day Gift Hamper | IZ-11 Paper Gift Box,,c7158b6d9eecb59be2cad1333940bea0,0.0,295
"Expelite Bhai Dooj Gift Combo Brother Dryfruits, Chocolates , Tika Roli Greeting -25pc Bars",606.0,https://www.flipkart.com/expelite-bhai-dooj-gift-combo-brother-dryfruits-chocolates-tika-roli-greeting-25pc-bars/p/itmd132f867cb3cb,flipkart,,,,INR,606.0,606.0,606.0,"Expelite Bhai Dooj Gift Combo Brother Dryfruits, Chocolates , Tika Roli Greeting -25pc Bars",,e8cfd6c89ce395577c9df850485639f5,0.0,296
"Expelite Special Rakhi Chocolate Combo, 35 g Each (PACK OF 6), Rakhi Gift for Sister Bars",253.0,https://www.flipkart.com/expelite-special-rakhi-chocolate-combo-35-g-each-pack-6-gift-sister-bars/p/itmc27afbee724ab,flipkart,,,35.0,INR,253.0,253.0,253.0,"Expelite Rakhi Chocolate Combo, 35 g Each (PACK OF 6), Rakhi Gift for Sister Bars",7.23,7ada0588da9ee8f697782fd7076cbb8f,0.0,297
Expelite Diwali Chocolate Gift Pack - 24 Pieces Diwali Gift Hamper with Dryfruits Bars,649.0,https://www.flipkart.com/expelite-diwali-chocolate-gift-pack-24-pieces-hamper-dryfruits-bars/p/itmf63d72c8ffb42,flipkart,,,,INR,649.0,649.0,649.0,Expelite Diwali Chocolate Gift Pack - 24 Pieces Diwali Gift Hamper with Dryfruits Bars,,2509cebeed64096fd811f98a06789007,0.0,298
Expelite Rakhi chocolate combo hamper pack for brother sister raksha bandhan Bars,245.0,https://www.flipkart.com/expelite-rakhi-chocolate-combo-hamper-pack-brother-sister-raksha-bandhan-bars/p/itm6d3ca9bcbb89a,flipkart,,,,INR,245.0,245.0,245.0,Expelite Rakhi chocolate combo hamper pack for brother sister raksha bandhan Bars,,51db0accc323587959c861c67ed0fa3c,0.0,299
Swankit's Dryfruits & Chocolate Combo with Wooden Tray Combo,877.0,https://www.flipkart.com/swankit-s-dryfruits-chocolate-combo-wooden-tray/p/itm162b4f0197792,flipkart,,,,INR,877.0,877.0,877.0,Swankit's Dryfruits & Chocolate Combo with Wooden Tray Combo,,76119532c0f709c03015a8be7f2ac11b,0.0,300
FERRERO ROCHER Chocolates With Christmas Card And Christmas Cap Combo,849.0,https://www.flipkart.com/ferrero-rocher-chocolates-christmas-card-cap-combo/p/itm7e84cd9dc4d21,flipkart,,,,INR,849.0,849.0,849.0,FERRERO ROCHER Chocolates With Christmas Card And Christmas Cap Combo,,de00ac245d290b33473a4b6c40cd02fa,0.0,301
"Ghasitaram Gifts Christmas-Wooden Cutlery Stand with T-lites, Kaju Katli, crunchy Cashews, Chocolate Coated Almonds Combo",2476.0,https://www.flipkart.com/ghasitaram-gifts-christmas-wooden-cutlery-stand-t-lites-kaju-katli-crunchy-cashews-chocolate-coated-almonds-combo/p/itmb7f752a53ed62,flipkart,,,,INR,2476.0,2476.0,2476.0,"Ghasitaram Gifts Christmas-Wooden Cutlery Stand with T-lites, Kaju Katli, crunchy Cashews, Chocolate Coated Almonds Combo",,c3bfd413b99ee97edeeadc7db951dfc5,0.0,302
"Expelite Holi Gift Chocolate Combo , 35 Grams Each (PACK OF 6) Bars",298.0,https://www.flipkart.com/expelite-holi-gift-chocolate-combo-35-grams-each-pack-6-bars/p/itmfa3c90daa115d,flipkart,,,35.0,INR,298.0,298.0,298.0,"Expelite Holi Gift Chocolate Combo , 35 Grams Each (PACK OF 6) Bars",8.51,c93bb67699bb11516c8d9f19d62cdc41,0.0,303
Expelite Almond FruitNut Chocolate Bar Combo|35 Grams Each -Pack of 4|Chocolate Gift Pack Bars,215.0,https://www.flipkart.com/expelite-almond-fruitnut-chocolate-bar-combo-35-grams-each-pack-4-chocolate-gift-pack-bars/p/itm6f20d07a2ded8,flipkart,,,35.0,INR,215.0,215.0,215.0,Expelite Almond FruitNut Chocolate Bar Combo|35 Grams Each -Pack of 4|Chocolate Gift Pack Bars,6.14,d99621d6539f9b74c0819969e968ca91,0.0,304
"Expelite Eid Mubarak Chocolate Gift Combo,35 Grams Each (Pack of 3) Bars",214.0,https://www.flipkart.com/expelite-eid-mubarak-chocolate-gift-combo-35-grams-each-pack-3-bars/p/itmc2a3cbc67dab7,flipkart,,,35.0,INR,214.0,214.0,214.0,"Expelite Eid Mubarak Chocolate Gift Combo,35 Grams Each (Pack of 3) Bars",6.11,5c35bee000a6b042ba67327363815bfa,0.0,305
"WINNI CELEBRATE RELATIONS Luxury 12 Pcs Chocolates+Almond & Cashew Dryfruits With Valentine Gift Card Pack Truffles, Bites",1549.0,https://www.flipkart.com/winni-celebrate-relations-luxury-12-pcs-chocolates-almond-cashew-dryfruits-valentine-gift-card-pack-truffles-bites/p/itmf36ef79e57ac3,flipkart,,,,INR,1549.0,1549.0,1549.0,"WINNI CELEBRATE RELATIONS Luxury 12 Pcs Chocolates+Almond & Cashew Dryfruits With Valentine Gift Card Pack Truffles, Bites",,1b2a21457dd8cd6c494a4deb52129ffc,0.0,306
GD Dryfruit 100% Natural Premium Whole Cashew 200Gm (Chocolate ) Flavour& Amla Candy 200Gm (Pack of 2) 400Gm (Combo Pack) Combo,426.0,https://www.flipkart.com/gd-dryfruit-100-natural-premium-whole-cashew-200gm-chocolate-flavour-amla-candy-pack-2-400gm-combo-pack-combo/p/itmf39fa195e1cb1,flipkart,,,400.0,INR,426.0,426.0,426.0,GD Dryfruit 100% Natural Premium Whole Cashew 200Gm (Chocolate ) Flavour& Amla Candy 200Gm (Pack of 2) 400Gm (Combo Pack) Combo,1.06,d29e47e418d6ae7d928286cf6db66d93,0.0,307
Expelite Chocolate for rakhi -12 pieces Best Rakhi gifts for sister Bars,259.0,https://www.flipkart.com/expelite-chocolate-rakhi-12-pieces-best-gifts-sister-bars/p/itmff8d78742d5e0,flipkart,,,,INR,259.0,259.0,259.0,Expelite Chocolate for rakhi -12 pieces Best Rakhi gifts for sister Bars,,ae39c8844c54d20819908af8ec59188b,0.0,308
OddClick Unique Happy Birthday My Dear Husband Chocolate Gifts Box Combo Pack Combo,315.0,https://www.flipkart.com/oddclick-unique-happy-birthday-my-dear-husband-chocolate-gifts-box-combo-pack/p/itmb065f92b44e18,flipkart,,,,INR,315.0,315.0,315.0,OddClick Unique Happy Birthday My Dear Husband Chocolate Gifts Box Combo Pack Combo,,bc78b81b6e0eaf09eaf84208f48cc464,0.0,309
LuvIt Luscious Fruit & Nut Chocolate | Multipack | Deliciously Smooth Bars,405.0,https://www.flipkart.com/luvit-luscious-fruit-nut-chocolate-multipack-deliciously-smooth-bars/p/itm245162ce7d29a,flipkart,,,,INR,405.0,405.0,405.0,LuvIt Luscious Fruit & Nut Chocolate | Multipack | Deliciously Smooth Bars,,743a8d8cdc91be8224abd7acc12ff487,0.0,310
OddClick Unique I Love You Valentine gift Chocolate Gifts Box Combo Pack Combo,270.0,https://www.flipkart.com/oddclick-unique-love-you-valentine-gift-chocolate-gifts-box-combo-pack/p/itmdef760ee21cb5,flipkart,,,,INR,270.0,270.0,270.0,OddClick Unique I Love You Valentine gift Chocolate Gifts Box Combo Pack Combo,,b6cfd8e0ae99c43ade607e8458738380,0.0,311
CHOCOINDIANART Super Welcome 12pcs Delicious Chocolate Gift || Bars,615.0,https://www.flipkart.com/chocoindianart-super-welcome-12pcs-delicious-chocolate-gift-bars/p/itmacd707d19f9e1,flipkart,,,,INR,615.0,615.0,615.0,CHOCOINDIANART Welcome 12pcs Delicious Chocolate Gift || Bars,,e5a08839df65695882bbdd4027f22e21,0.0,312
CHOCOINDIANART Graceful Happy New Year 18pcs Delicious Chocolate Gift 5 | Truffles,891.0,https://www.flipkart.com/chocoindianart-graceful-happy-new-year-18pcs-delicious-chocolate-gift-5-truffles/p/itm277fc5ed8f264,flipkart,,,,INR,891.0,891.0,891.0,CHOCOINDIANART Graceful Happy New Year 18pcs Delicious Chocolate Gift 5 | Truffles,,bedfa612fe62fef353c1386700def331,0.0,313
Zoroy Luxury Chocolate Votive Combo Gift Box with a beautiful gold votive Cookies & Drinking Chocolate Combo,1490.0,https://www.flipkart.com/zoroy-luxury-chocolate-votive-combo-gift-box-beautiful-gold-cookies-drinking/p/itm3496aa48b93fe,flipkart,,,,INR,1490.0,1490.0,1490.0,Zoroy Luxury Chocolate Votive Combo Gift Box with a beautiful gold votive Cookies & Drinking Chocolate Combo,,6b1384057814ada6779ddbb93253ec08,0.0,314
CHOCOINDIANART Graceful Happy Birthday Day-06pcs Delicious Chocolate Gift || Truffles,419.0,https://www.flipkart.com/chocoindianart-graceful-happy-birthday-day-06pcs-delicious-chocolate-gift-truffles/p/itm21901010dd6fe,flipkart,,,,INR,419.0,419.0,419.0,CHOCOINDIANART Graceful Happy Birthday Day-06pcs Delicious Chocolate Gift || Truffles,,7c6a38d0ba3a2145199e1334c65e552e,0.0,315
"Zoroy Luxury Chocolate Valentines day Message Box saying "" U Mean the World to Me"" Combo",980.0,https://www.flipkart.com/zoroy-luxury-chocolate-valentines-day-message-box-saying-u-mean-world-me-combo/p/itmfc9jhzsvx8zcw,flipkart,,,,INR,980.0,980.0,980.0,"Zoroy Luxury Chocolate Valentines day Message Box saying "" U Mean the World to Me"" Combo",,8dffac9fc66728289674d8801caabe57,0.0,316
Expelite Handcrafted Chocolates - 4 pieces Chocolates Gift Box Luxury Theme Bars,200.0,https://www.flipkart.com/expelite-handcrafted-chocolates-4-pieces-gift-box-luxury-theme-bars/p/itm77ec21e2953dd,flipkart,,,,INR,200.0,200.0,200.0,Expelite Handcrafted Chocolates - 4 pieces Chocolates Gift Box Luxury Theme Bars,,056d9ba02f1ec220baf491a0d475e608,0.0,317
Expelite Chocolate Gift Bar Box for Husband-100g For Anniversary Bars,175.0,https://www.flipkart.com/expelite-chocolate-gift-bar-box-husband-100g-anniversary-bars/p/itm9b42712103bd7,flipkart,,,100.0,INR,175.0,175.0,175.0,Expelite Chocolate Gift Bar Box for Husband-100g For Anniversary Bars,1.75,984734d7617cedeaaa81ce925e931fc6,0.0,318
A-ONE GROCERY T12 Luxury Chocolate Box for Valentine’s Day Celebration Truffles,282.0,https://www.flipkart.com/a-one-grocery-t12-luxury-chocolate-box-valentines-day-celebration-truffles/p/itmdb898d7be8816,flipkart,,,,INR,282.0,282.0,282.0,A-ONE GROCERY T12 Luxury Chocolate Box for Valentine’s Day Celebration Truffles,,4e5631c279d72ec2ffe18c06735c0e36,0.0,319
"FabBites Milk chocolate almond delight with 4 rakhi and roli, chawal Combo",399.0,https://www.flipkart.com/fabbites-milk-chocolate-almond-delight-4-rakhi-roli-chawal-combo/p/itm8b44c0361f320,flipkart,,,,INR,399.0,399.0,399.0,"FabBites Milk chocolate almond delight with 4 rakhi and roli, chawal Combo",,46f18087adaf6b4c1ef74ef71fab357d,0.0,320
TinyGlads Chocolate Treat Combo Box Truffles,986.0,https://www.flipkart.com/tinyglads-chocolate-treat-combo-box-truffles/p/itm85e11cd21cb0d,flipkart,,,,INR,986.0,986.0,986.0,TinyGlads Chocolate Treat Combo Box Truffles,,2bfd915adfc4e7f2e7810c666faece0b,0.0,321
TinyGlads Merry Christmas & New Year Chocolate Combo Gift Bites,838.0,https://www.flipkart.com/tinyglads-merry-christmas-new-year-chocolate-combo-gift-bites/p/itm0f44794bff2c6,flipkart,,,,INR,838.0,838.0,838.0,TinyGlads Merry Christmas & New Year Chocolate Combo Gift Bites,,610a3ca4357611f301bbf3b3b22269f7,0.0,322
TinyGlads New Year Chocolate Combo Pack Bites,986.0,https://www.flipkart.com/tinyglads-new-year-chocolate-combo-pack-bites/p/itmdbd48a396a7da,flipkart,,,,INR,986.0,986.0,986.0,TinyGlads New Year Chocolate Combo Pack Bites,,35d656e1d04caecc28fe94ba1800c434,0.0,323
TinyGlads Dual Festive Christmas & New Year Chocolate Combo Pack Bites,738.0,https://www.flipkart.com/tinyglads-dual-festive-christmas-new-year-chocolate-combo-pack-bites/p/itm06517cb6e97f0,flipkart,,,,INR,738.0,738.0,738.0,TinyGlads Dual Festive Christmas & New Year Chocolate Combo Pack Bites,,d85be3438a7e3544db473dbbd53c7be2,0.0,324
"TinyGlads Premium Chocolate Jars Combo | Festive & Corporate Gifting Truffles, Bites",1318.0,https://www.flipkart.com/tinyglads-premium-chocolate-jars-combo-festive-corporate-gifting-truffles-bites/p/itme8a55c7030292,flipkart,,,,INR,1318.0,1318.0,1318.0,"TinyGlads Premium Chocolate Jars Combo | Festive & Corporate Gifting Truffles, Bites",,55e9a938fe492784261f4bbdd04a73e1,0.0,325
"Midiron Rakhi gift Pack, Rakhi Celebration Chocolate Box with Rakhi Combo",344.0,https://www.flipkart.com/midiron-rakhi-gift-pack-celebration-chocolate-box-combo/p/itmef80f8bf0fdcf,flipkart,,,,INR,344.0,344.0,344.0,"Midiron Rakhi gift Pack, Rakhi Celebration Chocolate Box with Rakhi Combo",,b5ad5311df8e4d117f292630b2cd46ae,0.0,326
"Expelite Special Rakhi Combo gift Pack to bhai -4 pieces Raksha bandhan chocolate Gift box Bars, Bites",207.0,https://www.flipkart.com/expelite-special-rakhi-combo-gift-pack-bhai-4-pieces-raksha-bandhan-chocolate-box-bars-bites/p/itm1540aacc13e2b,flipkart,,,,INR,207.0,207.0,207.0,"Expelite Rakhi Combo gift Pack to bhai -4 pieces Raksha bandhan chocolate Gift box Bars, Bites",,9deabc45d3ac6effd3de0b7ec4d83b15,0.0,327
CHOCOINDIANART Good Happy Merry Christmas 06pcs Delicious Chocolate Gift 1 Truffles,176.0,https://www.flipkart.com/chocoindianart-good-happy-merry-christmas-06pcs-delicious-chocolate-gift-1-truffles/p/itmbf0aa19b36c42,flipkart,,,,INR,176.0,176.0,176.0,CHOCOINDIANART Good Happy Merry Christmas 06pcs Delicious Chocolate Gift 1 Truffles,,8de4f23862a0bb76ef3471a575e3a6c4,0.0,328
CHOCOINDIANART Gorgeous Merry Christmas 06pcs Delicious Chocolate Gift Truffles,176.0,https://www.flipkart.com/chocoindianart-gorgeous-merry-christmas-06pcs-delicious-chocolate-gift-truffles/p/itm48e1103e8949d,flipkart,,,,INR,176.0,176.0,176.0,CHOCOINDIANART Gorgeous Merry Christmas 06pcs Delicious Chocolate Gift Truffles,,746aed68e893be5b1f1a10ce541cc58a,0.0,329
CHOCOINDIANART Graceful Happy New Year 06pcs Delicious Chocolate Gift Truffles,245.0,https://www.flipkart.com/chocoindianart-graceful-happy-new-year-06pcs-delicious-chocolate-gift-truffles/p/itm1906bb042c274,flipkart,,,,INR,245.0,245.0,245.0,CHOCOINDIANART Graceful Happy New Year 06pcs Delicious Chocolate Gift Truffles,,696d3b7be0f628911238df38612053fd,0.0,330
CHOCOINDIANART Nice Merry Christmas 06pcs Delicious Chocolate Gift Truffles,185.0,https://www.flipkart.com/chocoindianart-nice-merry-christmas-06pcs-delicious-chocolate-gift-truffles/p/itmafce45b41ec83,flipkart,,,,INR,185.0,185.0,185.0,CHOCOINDIANART Nice Merry Christmas 06pcs Delicious Chocolate Gift Truffles,,f8c0d806056b16a8fc1324a3b1f01641,0.0,331
CHOCOINDIANART Interesting Merry Christmas 06pcs Delicious Chocolate Gift Truffles,185.0,https://www.flipkart.com/chocoindianart-interesting-merry-christmas-06pcs-delicious-chocolate-gift-truffles/p/itmab030b1f2e574,flipkart,,,,INR,185.0,185.0,185.0,CHOCOINDIANART Interesting Merry Christmas 06pcs Delicious Chocolate Gift Truffles,,a6ce1190f065c3fea3d630d77ab5ab2f,0.0,332
CHOCOINDIANART Very Nice Merry Christmas 06pcs Delicious Chocolate Gift Truffles,185.0,https://www.flipkart.com/chocoindianart-very-nice-merry-christmas-06pcs-delicious-chocolate-gift-truffles/p/itmaaa2df90b6bae,flipkart,,,,INR,185.0,185.0,185.0,CHOCOINDIANART Very Nice Merry Christmas 06pcs Delicious Chocolate Gift Truffles,,194ab3b5428a6bb639431f97dae710a9,0.0,333
BLISSFULL BITES Birthday Celebration Chocolate Bar – Luxury Sweet Gift Bars,233.0,https://www.flipkart.com/blissfull-bites-birthday-celebration-chocolate-bar-luxury-sweet-gift-bars/p/itm6a80d02eca4bf,flipkart,,,,INR,233.0,233.0,233.0,BLISSFULL BITES Birthday Celebration Chocolate Bar – Luxury Sweet Gift Bars,,86d13963bbe015f9dfeb01d1acacae1f,0.0,334
CHOCOINDIANART Beautiful Happy New Year 06pcs Delicious Chocolate Gift Truffles,245.0,https://www.flipkart.com/chocoindianart-beautiful-happy-new-year-06pcs-delicious-chocolate-gift-truffles/p/itm7a54d7cba8eb9,flipkart,,,,INR,245.0,245.0,245.0,CHOCOINDIANART Beautiful Happy New Year 06pcs Delicious Chocolate Gift Truffles,,7dd1f48278c9c620282762c03fc0b54f,0.0,335
Expelite Unique Diwali Chocolates gift - Beautiful Diwali Gift for Sister 6 wrapped choc Bars,205.0,https://www.flipkart.com/expelite-unique-diwali-chocolates-gift-beautiful-sister-6-wrapped-choc-bars/p/itm306fea1840b0f,flipkart,,,,INR,205.0,205.0,205.0,Expelite Unique Diwali Chocolates gift - Beautiful Diwali Gift for Sister 6 wrapped choc Bars,,ca22b2cbdef8f9c8c3cf9f1dbd0a0172,0.0,336
LuvIt Luscious Milk Chocolate | Multipack | Deliciously Smooth Bars,405.0,https://www.flipkart.com/luvit-luscious-milk-chocolate-multipack-deliciously-smooth-bars/p/itm387ab2d3c89ba,flipkart,,,,INR,405.0,405.0,405.0,LuvIt Luscious Milk Chocolate | Multipack | Deliciously Smooth Bars,,f2996943a059c0bbd25dca76a6261e07,0.0,337
CHOCOINDIANART Classic Happy Valentine Day 6pcs Delicious Chocolate Gift (11) || Truffles,101.0,https://www.flipkart.com/chocoindianart-classic-happy-valentine-day-6pcs-delicious-chocolate-gift-11-truffles/p/itm01bb1cd512ddb,flipkart,,,,INR,101.0,101.0,101.0,CHOCOINDIANART Classic Happy Valentine Day 6pcs Delicious Chocolate Gift (11) || Truffles,,41d1eef920ca949819ba32b67c19de31,0.0,338
Expelite Happy Anniversary Chocolate Bar Gift for Boyfriend -100 gm Happy Anniversary Chocolate gift Box for Girlfriend Bars,172.0,https://www.flipkart.com/expelite-happy-anniversary-chocolate-bar-gift-boyfriend-100-gm-box-girlfriend-bars/p/itmddf3d1f42927b,flipkart,,,100.0,INR,172.0,172.0,172.0,Expelite Happy Anniversary Chocolate Bar Gift for Boyfriend -100 gm Happy Anniversary Chocolate gift Box for Girlfriend Bars,1.72,c6dee960d6eb35aa939581e8ee843799,0.0,339
CHOCOINDIANART Graceful Happy Valentine Day 6pcs Delicious Chocolate Gift Truffles,232.0,https://www.flipkart.com/chocoindianart-graceful-happy-valentine-day-6pcs-delicious-chocolate-gift-truffles/p/itmf3decfaa98535,flipkart,,,,INR,232.0,232.0,232.0,CHOCOINDIANART Graceful Happy Valentine Day 6pcs Delicious Chocolate Gift Truffles,,df25227375b7c3dce6df0cee9ec3ba71,0.0,340
"CHOCOINDIANART Graceful Happy Birthday, 06pcs Delicious Chocolate Gift, Truffles",244.0,https://www.flipkart.com/chocoindianart-graceful-happy-birthday-06pcs-delicious-chocolate-gift-truffles/p/itm2630b40141bdb,flipkart,,,,INR,244.0,244.0,244.0,"CHOCOINDIANART Graceful Happy Birthday, 06pcs Delicious Chocolate Gift, Truffles",,a8b57f83299710c4ca2d056d36fcbf94,0.0,341
"CHOCOINDIANART Graceful Happy Birthday Day, 06pcs Delicious Chocolate Gift, Truffles",223.0,https://www.flipkart.com/chocoindianart-graceful-happy-birthday-day-06pcs-delicious-chocolate-gift-truffles/p/itm0a12ebccb64b1,flipkart,,,,INR,223.0,223.0,223.0,"CHOCOINDIANART Graceful Happy Birthday Day, 06pcs Delicious Chocolate Gift, Truffles",,ed0cd7ca0618d045591e63148cadad01,0.0,342
"CHOCOINDIANART Graceful Happy Valentine's Day, 06pcs Delicious Chocolate Gift, Truffles",215.0,https://www.flipkart.com/chocoindianart-graceful-happy-valentine-s-day-06pcs-delicious-chocolate-gift-truffles/p/itmb26a8df16fd5e,flipkart,,,,INR,215.0,215.0,215.0,"CHOCOINDIANART Graceful Happy Valentine's Day, 06pcs Delicious Chocolate Gift, Truffles",,d91c4a8004f9c9095020dcd80ac232e1,0.0,343
CHOCOINDIANART Pleasing Happy Lohri 06pcs Delicious Chocolate Gift | Truffles,382.0,https://www.flipkart.com/chocoindianart-pleasing-happy-lohri-06pcs-delicious-chocolate-gift-truffles/p/itm45a9c013e2a29,flipkart,,,,INR,382.0,382.0,382.0,CHOCOINDIANART Pleasing Happy Lohri 06pcs Delicious Chocolate Gift | Truffles,,874c32d7d590f1c31af71ecfcf0714ee,0.0,344
"CHOCOINDIANART Elegant Happy Lohri, 06pcs Delicious Chocolate Gift, || Truffles",382.0,https://www.flipkart.com/chocoindianart-elegant-happy-lohri-06pcs-delicious-chocolate-gift-truffles/p/itm430a936440e62,flipkart,,,,INR,382.0,382.0,382.0,"CHOCOINDIANART Elegant Happy Lohri, 06pcs Delicious Chocolate Gift, || Truffles",,46e531e7f4419bbf99fc6fddcfed5d43,0.0,345
Expelite Happy Anniversary Chocolate Bar Gift for Boyfriend-100g | Bars,219.0,https://www.flipkart.com/expelite-happy-anniversary-chocolate-bar-gift-boyfriend-100g-bars/p/itm5fcd976debd6e,flipkart,,,100.0,INR,219.0,219.0,219.0,Expelite Happy Anniversary Chocolate Bar Gift for Boyfriend-100g | Bars,2.19,1a0597a834d854ef6b4b18c0e136415a,0.0,346
CHOCOINDIANART Beautiful Happy Valentine Day 06pcs Delicious Chocolate Gift 4 Truffles,265.0,https://www.flipkart.com/chocoindianart-beautiful-happy-valentine-day-06pcs-delicious-chocolate-gift-4-truffles/p/itm5063cdad57d4a,flipkart,,,,INR,265.0,265.0,265.0,CHOCOINDIANART Beautiful Happy Valentine Day 06pcs Delicious Chocolate Gift 4 Truffles,,09891286ec3676c6480cbe4768cbc4d8,0.0,347
"CHOCOINDIANART Super Happy Valentine's Day, 06pcs Delicious Chocolate Gift, Truffles",318.0,https://www.flipkart.com/chocoindianart-super-happy-valentine-s-day-06pcs-delicious-chocolate-gift-truffles/p/itmc0e2d82c87d9f,flipkart,,,,INR,318.0,318.0,318.0,"CHOCOINDIANART Happy Valentine's Day, 06pcs Delicious Chocolate Gift, Truffles",,12ad0ffc40e7c8e6ddd47912a7f49c10,0.0,348
"CHOCOINDIANART Sweet 20th Anniversary, 12pcs Delicious Chocolate Gift Box, Bars",388.0,https://www.flipkart.com/chocoindianart-sweet-20th-anniversary-12pcs-delicious-chocolate-gift-box-bars/p/itme7c102e177337,flipkart,,,,INR,388.0,388.0,388.0,"CHOCOINDIANART Sweet 20th Anniversary, 12pcs Delicious Chocolate Gift Box, Bars",,3c3d87dc58c2a994eb0c7f380ed6658c,0.0,349
Midiron Perfect Gift For Your Love One's That Comes With 15 Pieces Luxury Black Chocolate in Tin Heart Box For Every Special Occasion Gifts IZ19Choco15TinBox4Pur-02 Bites,270.0,https://www.flipkart.com/midiron-perfect-gift-your-love-one-s-comes-15-pieces-luxury-black-chocolate-tin-heart-box-every-special-occasion-gifts-iz19choco15tinbox4pur-02-bites/p/itmfehh8yxybgnep,flipkart,,,,INR,270.0,270.0,270.0,Midiron Perfect Gift For Your Love One's That Comes With 15 Pieces Luxury Black Chocolate in Tin Heart Box For Every Occasion Gifts IZ19Choco15TinBox4Pur-02 Bites,,ba40b02c9db833540e1b190a1e247185,0.0,350
BLISSFULL BITES Premium Assorted Chocolate Box 6 Pieces | Luxury Chocolate Gift Pack Bars,270.0,https://www.flipkart.com/blissfull-bites-premium-assorted-chocolate-box-6-pieces-luxury-gift-pack-bars/p/itm925108f45f477,flipkart,,,,INR,270.0,270.0,270.0,BLISSFULL BITES Premium Assorted Chocolate Box 6 Pieces | Luxury Chocolate Gift Pack Bars,,ca1e9d6c7e5de1f6e8731c7b3714acbb,0.0,351
