name,price,url,source,rating,reviews,weight_g,original_currency,original_value,standardized_price_inr,price_inr,cleaned_name,price_per_gram,dedup_hash,popularity_score,popularity_rank
"Cadbury Celebrations Assorted Chocolate Diwali Gift Pack, 144.1 gram",95.0,https://www.amazon.in/dp/B07FHDDK1M,amazon,4.3,,,INR,95.0,95.0,95.0,"Cadbury Celebrations Assorted Chocolate Diwali Gift Pack, 144.1 gram",,5bf070ef464da290df001aa3b544753d,45.26,1
"Cadbury Celebrations Assorted Chocolate Gift Pack, 141.68 g",145.0,https://www.amazon.in/dp/B07F2G714R,amazon,4.2,,141.68,INR,145.0,145.0,145.0,"Cadbury Celebrations Assorted Chocolate Gift Pack, 141.68 g",1.02,7d0117405ac39d431a0059f9724d0219,41.18,2
"SMOOR Assorted Choco Truffles Box | Milk Chocolate with Centre Filling | Premium Chocolate for Wedding, Birthday, Annivers...",124.0,https://www.amazon.in/dp/B0BFQC78J4,amazon,4.4,,,INR,124.0,124.0,124.0,"SMOOR Assorted Choco Truffles Box | Milk Chocolate with Centre Filling | Premium Chocolate for Wedding, Birthday, Annivers...",,9a58470478853c603b8b75f137f5a86e,35.48,3
"Dessert Spring Happy Birthday Chocolate Gift Box, 185g Assorted Premium Pralines, Luxury 16pc Milk & Dark Chocolate Hampe...",249.0,https://www.amazon.in/dp/B0DJRHCMMK,amazon,4.5,,185.0,INR,249.0,249.0,249.0,"Dessert Spring Happy Birthday Chocolate Gift Box, 185g Assorted Premium Pralines, Luxury 16pc Milk & Dark Chocolate Hampe...",1.35,12d23098fa19692d2cedad85021ba540,33.33,4
4700BC Nutty Tuxedo Chocolate Popcorn | Gifting Tin | 150g,186.0,https://www.amazon.in/dp/B074DXB9SB,amazon,4.1,,150.0,INR,186.0,186.0,186.0,4700BC Nutty Tuxedo Chocolate Popcorn | Gifting Tin | 150g,1.24,54de8df8e166aa42294db3b0ea1c56bc,33.06,5
Hyperfoods® Valentine'S Chocolate Gift Hamper 175G Tin Box Valentine Gifts Valentine Gift For Girlfriend Valentines Gift F...,299.0,https://www.amazon.in/dp/B0D9JSJC3V,amazon,5.0,,175.0,INR,299.0,299.0,299.0,Hyperfoods® Valentine'S Chocolate Gift Hamper 175G Tin Box Valentine Gifts Valentine Gift For Girlfriend Valentines Gift F...,1.71,3c6a627e83ef90417bd9dcac06a40b3b,29.24,6
"SFU E Com Chocolate with Cute Teddy Hamper | Gift for Holi, Rakhi, Diwali, Anniversary, Birthday, Christmas, Valentine, He...",151.0,https://www.amazon.in/dp/B07T3K3RJ7,amazon,3.9,,,INR,151.0,151.0,151.0,"SFU E Com Chocolate with Cute Teddy Hamper | Gift for Holi, Rakhi, Diwali, Anniversary, Birthday, Christmas, Valentine, He...",,789adadc341ec80fdc54bee627e8c936,25.83,7
"Cadbury Celebrations Premium Selections Chocolates Diwali Gift Pack,268 Gram",190.0,https://www.amazon.in/dp/B07F2KKDD5,amazon,4.3,,,INR,190.0,190.0,190.0,"Cadbury Celebrations Premium Selections Chocolates Diwali Gift Pack,268 Gram",,693c06888483bbe421f7dfff5f61c13d,22.63,8
"4700BC Gourmet Popcorn Gift Box (4 Tins – BBQ Cheese, Salted Caramel, Mocha Walnut & Nutty Tuxedo Chocolate, 460g) | Premi...",977.0,https://www.amazon.in/dp/B07H8WKF5V,amazon,4.4,,460.0,INR,977.0,977.0,977.0,"4700BC Gourmet Popcorn Gift Box (4 Tins – BBQ Cheese, Salted Caramel, Mocha Walnut & Nutty Tuxedo Chocolate, 460g) | Premi...",2.12,11b56fbaaa584048ce2bb5088c7521d6,20.75,9
"Chocoloony Chocolate Gift Hamper Basket with 40 pcs Milk Chocolate (240gm) for Gift Sister, Wife and Girlfriend",475.0,https://www.amazon.in/dp/B08KYFVZ11,amazon,4.1,,240.0,INR,475.0,475.0,475.0,"Chocoloony Chocolate Gift Hamper Basket with 40 pcs Milk Chocolate (240gm) for Gift Sister, Wife and Girlfriend",1.98,3c19295d4ce76008e1ca616487fcbe33,20.71,10
"Tosca Muso Gold Centre Filled Chocolate Truffles | Milk Chocolate Gift Box | Luxury, Individually Wrapped Chocolates for P...",249.0,https://www.amazon.in/dp/B0G6DTLV1L,amazon,5.0,,,INR,249.0,249.0,249.0,"Tosca Muso Gold Centre Filled Chocolate Truffles | Milk Chocolate Gift Box | Luxury, Individually Wrapped Chocolates for P...",,a30d8f6cb575541d4185201b81f30027,20.08,11
"Cadbury Dairy Milk Silk Miniatures Premium Assorted Chocolate Gift pack, 240 g",562.0,https://www.amazon.in/dp/B0GGDGRQD7,amazon,4.5,,240.0,INR,562.0,562.0,562.0,"Cadbury Dairy Milk Silk Miniatures Premium Assorted Chocolate Gift pack, 240 g",2.34,234a0f06d9a3f3ee448bb22070cf1839,19.23,12
"SFU E Com Cadbury Chocolate Gift Combo|Gift for Holi, Rakhi, Diwali, Birthday, Anniversary, Valentine, Him, Her|Chocolate ...",209.0,https://www.amazon.in/dp/B07PT78QJK,amazon,4.0,,,INR,209.0,209.0,209.0,"SFU E Com Cadbury Chocolate Gift Combo|Gift for Holi, Rakhi, Diwali, Birthday, Anniversary, Valentine, Him, Her|Chocolate ...",,ad5214b3b246e640ad40b6065896f83b,19.14,13
Pure Temptation Chocoblast Celebration Gift Box | 196g Chocolate-Filled Waffle Cones | Premium Chocolate Gift Hamper for M...,449.0,https://www.amazon.in/dp/B0FGJVSHMS,amazon,4.2,,196.0,INR,449.0,449.0,449.0,Pure Temptation Chocoblast Celebration Gift Box | 196g Chocolate-Filled Waffle Cones | Premium Chocolate Gift Hamper for M...,2.29,fcca2827298d70b48bfd2cd46dead3d0,18.34,14
"CookieMan Premium Chocolate Gift Box – 25 Center-Filled Chocolates, 275g | Indulgent Hazelnut, Strawberry & English Toffee...",585.0,https://www.amazon.in/dp/B09J91LBPN,amazon,3.9,,275.0,INR,585.0,585.0,585.0,"CookieMan Premium Chocolate Gift Box – 25 Center-Filled Chocolates, 275g | Indulgent Hazelnut, Strawberry & English Toffee...",2.13,b8492361580a55383edea4e45c25cbd0,18.31,15
CHOKOTABS+ Tabs Chocolate for Men and Women | Premium tabs Dark Chocolate for Couple | Perfect Gourmet Chocolate Gift Box ...,284.0,https://www.amazon.in/dp/B0GQ2HNKK1,amazon,5.0,,,INR,284.0,284.0,284.0,CHOKOTABS+ Tabs Chocolate for Men and Women | Premium tabs Dark Chocolate for Couple | Perfect Gourmet Chocolate Gift Box ...,,7986b18221705cf64defe0872bbb9188,17.61,16
"Hugs Ghana Twist Dark Chocolates Jar – Premium Center Filled Dark Chocolate Truffles | Chocolate Gift Pack for Birthday, A...",199.0,https://www.amazon.in/dp/B0FNMNFQ6V,amazon,3.5,,,INR,199.0,199.0,199.0,"Hugs Ghana Twist Dark Chocolates Jar – Premium Center Filled Dark Chocolate Truffles | Chocolate Gift Pack for Birthday, A...",,f9dbc1a5d6da95caa21a4ef1043c78e0,17.59,17
Loyka Almond Brittle Assorted Choco Box - 8 pcs 116gm | Premium Chocolate Gift Hamper | Choco & Nut Dryfruit Delicacy | Ro...,299.0,https://www.amazon.in/dp/B0BF4FXP8L,amazon,4.3,,116.0,INR,299.0,299.0,299.0,Loyka Almond Brittle Assorted Choco Box - 8 pcs 116gm | Premium Chocolate Gift Hamper | Choco & Nut Dryfruit Delicacy | Ro...,2.58,534ea536cc4d471a2be24ca699905842,16.67,18
"SFU E Com Overloaded Crunchy Kitkat Chocolate Box | Chocolate Gift Hamper For Rakhi, Diwali, Christmas, New Year, Birthda...",239.0,https://www.amazon.in/dp/B0CDV9SJ5D,amazon,3.9,,,INR,239.0,239.0,239.0,"SFU E Com Overloaded Crunchy Kitkat Chocolate Box | Chocolate Gift Hamper For Rakhi, Diwali, Christmas, New Year, Birthda...",,c5dbf961c6fed9407f970cc5be55fe68,16.32,19
Loyka Almond Brittle Gold Choco Box - 8 pcs 116gm | Premium Chocolate Gift Hamper | Chocolate & Nut Dryfruit Delicacy | Ro...,313.0,https://www.amazon.in/dp/B0B68697VN,amazon,4.4,,116.0,INR,313.0,313.0,313.0,Loyka Almond Brittle Gold Choco Box - 8 pcs 116gm | Premium Chocolate Gift Hamper | Chocolate & Nut Dryfruit Delicacy | Ro...,2.7,a3dcde6a631799743cfa32c5b7861691,16.3,20
"Cadbury Studio Signature Pralines Brownie Aux Noix Chocolate Gift Pack, 130 g",352.0,https://www.amazon.in/dp/B0DDCSWYG8,amazon,4.2,,130.0,INR,352.0,352.0,352.0,"Cadbury Studio Signature Pralines Brownie Aux Noix Chocolate Gift Pack, 130 g",2.71,bbc7e0a69c5b7ebd3a59ac65706db36f,15.5,21
Open Secret Chocolate Brownie Gift Box | 5 Mini Gourmet Brownies | Assorted Chocolate Dessert Hamper | Festive Sweets & Ho...,265.0,https://www.amazon.in/dp/B0G1CH4FMM,amazon,4.1,,,INR,265.0,265.0,265.0,Open Secret Chocolate Brownie Gift Box | 5 Mini Gourmet Brownies | Assorted Chocolate Dessert Hamper | Festive Sweets & Ho...,,2ee4d1198caeb7aa715d781304c8db49,15.47,22
"BILZEN Gourmet Assorted (Milk, Dark & White) Chocolates with Dates and Roasted Almonds Gift Box I No Preservative | No Add...",299.0,https://www.amazon.in/dp/B0CKHTDMKW,amazon,4.6,,,INR,299.0,299.0,299.0,"BILZEN Gourmet Assorted (Milk, Dark & White) Chocolates with Dates and Roasted Almonds Gift Box I No Preservative | No Add...",,ad5f86b0caa284b50c27085ca9ff8ebc,15.38,23
"HARIBAS Premium Chocolate Gift Pack, Assorted Chocolates and Cookies Hamper Diwali Gift Pack – 7‑in‑1",299.0,https://www.amazon.in/dp/B0FNJWJJQP,amazon,4.6,,,INR,299.0,299.0,299.0,"HARIBAS Premium Chocolate Gift Pack, Assorted Chocolates and Cookies Hamper Diwali Gift Pack – 7‑in‑1",,062190a4232cf3031ed5620708826eb2,15.38,24
"Cadbury Studio Signature Pralines Gianduja Hazelnut Chocolate Gift Pack, 130 g",356.0,https://www.amazon.in/dp/B0DDCTNK2R,amazon,4.2,,130.0,INR,356.0,356.0,356.0,"Cadbury Studio Signature Pralines Gianduja Hazelnut Chocolate Gift Pack, 130 g",2.74,cf8f01cb8020bf5836f524d4ed83c276,15.33,25
"Open Secret Chocolate Celebration Gift Box | 12 Cookies Assortment | Premium Gourmet Cookie Gift Hamper | White Cashew, Ch...",278.0,https://www.amazon.in/dp/B08KF3QKZ6,amazon,4.2,,,INR,278.0,278.0,278.0,"Open Secret Chocolate Celebration Gift Box | 12 Cookies Assortment | Premium Gourmet Cookie Gift Hamper | White Cashew, Ch...",,5e318b61c98107fa84638eeca2827999,15.11,26
Chokola Chocolate Dessert Squares 90g – Chocolate Sponge Cake Enrobed in Dark Chocolate | Gourmet Chocolate Gift Hamper | ...,272.0,https://www.amazon.in/dp/B08D6V3W3F,amazon,4.5,,90.0,INR,272.0,272.0,272.0,Chokola Chocolate Dessert Squares 90g – Chocolate Sponge Cake Enrobed in Dark Chocolate | Gourmet Chocolate Gift Hamper | ...,3.02,85d480e5666a35e3eaae7894ba66bbc2,14.9,27
Pure Temptation Chocoblast Celebration Gift Box | 8 Chocolate-Filled Waffle Cones | Premium Chocolate Box for Gift | Choco...,297.0,https://www.amazon.in/dp/B0FGQK44WC,amazon,4.2,,,INR,297.0,297.0,297.0,Pure Temptation Chocoblast Celebration Gift Box | 8 Chocolate-Filled Waffle Cones | Premium Chocolate Box for Gift | Choco...,,6cf60c64ea30963d8bf0bd91d25b0d77,14.14,28
BILZEN Gourmet Dark Chocolates with Dates and Roasted Almonds Gift Box | No Preservative I No Added Sugar |Healthy Snacks...,299.0,https://www.amazon.in/dp/B0CKFHLJ6Y,amazon,4.0,,,INR,299.0,299.0,299.0,BILZEN Gourmet Dark Chocolates with Dates and Roasted Almonds Gift Box | No Preservative I No Added Sugar |Healthy Snacks...,,cef5a56dca65689af2ed0ea9b3d341e3,13.38,29
"999 Chocolat 60% & 80% Dark Chocolate (Pack of 2 (140g))| Organic, Handmade Vegan Couverture Bar with Coconut Sugar | No R...",570.0,https://www.amazon.in/dp/B0DNSM91LK,amazon,5.0,,140.0,INR,570.0,570.0,570.0,"999 Chocolat 60% & 80% Dark Chocolate (Pack of 2 (140g))| Organic, Handmade Vegan Couverture Bar with Coconut Sugar | No R...",4.07,3735ce1098836f85d04b872c41cbdd4b,12.29,30
Hyperfoods® Valentines Day Gifts For Girlfriend Chocolates Gift Hamper Chocolate Pack Sapphire Hazelfills 16 Pcs Chocolate...,299.0,https://www.amazon.in/dp/B0D9JT9PLC,amazon,3.6,,,INR,299.0,299.0,299.0,Hyperfoods® Valentines Day Gifts For Girlfriend Chocolates Gift Hamper Chocolate Pack Sapphire Hazelfills 16 Pcs Chocolate...,,08b529c1549226d56bb7dfff83cf1893,12.04,31
Loyka Almond Florentine/Chocolate Almond Box - 12 pcs | Premium Chocolate Gift Hamper | Choco & Nut Dryfruit Delicacy | Ca...,359.0,https://www.amazon.in/dp/B0C1C9RC4B,amazon,4.2,,,INR,359.0,359.0,359.0,Loyka Almond Florentine/Chocolate Almond Box - 12 pcs | Premium Chocolate Gift Hamper | Choco & Nut Dryfruit Delicacy | Ca...,,b694e2243b138d1a6828aca6bf7e9a00,11.7,32
"999 Chocolat 70% Premium Dark Chocolate Bar (Pack of 1 (70g)) Organic Dark Chocolate No Refined Sugar, No Preservative, No...",280.0,https://www.amazon.in/dp/B0CNKH5M66,amazon,4.6,,70.0,INR,280.0,280.0,280.0,"999 Chocolat 70% Premium Dark Chocolate Bar (Pack of 1 (70g)) Organic Dark Chocolate No Refined Sugar, No Preservative, No...",4.0,0aba58c320025b147e266bff39959598,11.5,33
"999 Chocolat 70% Dark Chocolate Bar – (Pack of 3 (210g)) Organic Cocoa Dark Chocolate, Pure Couverture Chocolate, No Refin...",840.0,https://www.amazon.in/dp/B0FB9G74YG,amazon,4.6,,210.0,INR,840.0,840.0,840.0,"999 Chocolat 70% Dark Chocolate Bar – (Pack of 3 (210g)) Organic Cocoa Dark Chocolate, Pure Couverture Chocolate, No Refin...",4.0,838166ae3262ed3cc99b38a307238eb1,11.5,34
"CookieMan Premium Center Filled Truffle Chocolates Gift Pack, Assorted Box of 12 Pcs – Hazelnut, Strawberry, English Toffe...",359.0,https://www.amazon.in/dp/B09J912FNG,amazon,3.9,,,INR,359.0,359.0,359.0,"CookieMan Premium Center Filled Truffle Chocolates Gift Pack, Assorted Box of 12 Pcs – Hazelnut, Strawberry, English Toffe...",,4d8d9a532ab654fe0825241b1e5a1acd,10.86,35
"Barquillo Assorted Premium Chocolate Gift Pack Box - 9 Pcs (180 gm) | Roasted Almonds, Hazelnut and Pistachio imported | D...",649.0,https://www.amazon.in/dp/B0CKTL8S18,amazon,3.9,,180.0,INR,649.0,649.0,649.0,"Barquillo Assorted Premium Chocolate Gift Pack Box - 9 Pcs (180 gm) | Roasted Almonds, Hazelnut and Pistachio imported | D...",3.61,01de8e814a02a60466740e011cba21d9,10.8,36
Loyka Hazelnut Florentine Box - 12 pcs | Premium Chocolate Gift Hamper | Choco & Nut Dryfruit Delicacy | Caramalised Hazel...,399.0,https://www.amazon.in/dp/B0C1CDWSJR,amazon,4.3,,,INR,399.0,399.0,399.0,Loyka Hazelnut Florentine Box - 12 pcs | Premium Chocolate Gift Hamper | Choco & Nut Dryfruit Delicacy | Caramalised Hazel...,,1f8edccc7928b0d003e6cb4c14455922,10.78,37
EROTE Premium Fantasy Dark Chocolate | For Men And Women | Him Her | Gourmet Mini Bars for Gifting & Special Moments | 6 C...,299.0,https://www.amazon.in/dp/B0G6173NX4,amazon,3.2,,,INR,299.0,299.0,299.0,EROTE Premium Fantasy Dark Chocolate | For Men And Women | Him Her | Gourmet Mini Bars for Gifting & Moments | 6 C...,,ff31e59e0b7d5e8fa7bec0c832a2f354,10.7,38
Astonished Retail Chocolate Gift Hamper with Multipurpose Basket|Chocolate Gift Collection|Chocolate Gift To Gift Your Lov...,399.0,https://www.amazon.in/dp/B08L1RRM2V,amazon,4.2,,,INR,399.0,399.0,399.0,Astonished Retail Chocolate Gift Hamper with Multipurpose Basket|Chocolate Gift Collection|Chocolate Gift To Gift Your Lov...,,3bebe6e1f6c36226303611d3b635ac1f,10.53,39
LOYKA Almond Brittle Gold Choco Box 14 Pcs (Pack of 1) | Premium Chocolate Gift Hamper|Choco & Nut Dryfruit Delicacy|Roast...,445.0,https://www.amazon.in/dp/B08P4BVTFK,amazon,4.6,,,INR,445.0,445.0,445.0,LOYKA Almond Brittle Gold Choco Box 14 Pcs (Pack of 1) | Premium Chocolate Gift Hamper|Choco & Nut Dryfruit Delicacy|Roast...,,0acfa7aa7ca3aca42aafb7c5a438d895,10.34,40
"999 Chocolat 60% & 70% Dark Chocolate (Pack of 2 (140g))| Organic, Handmade Vegan Couverture Bar with Coconut Sugar | No R...",560.0,https://www.amazon.in/dp/B0DNSLP127,amazon,4.1,,140.0,INR,560.0,560.0,560.0,"999 Chocolat 60% & 70% Dark Chocolate (Pack of 2 (140g))| Organic, Handmade Vegan Couverture Bar with Coconut Sugar | No R...",4.0,961278d060989136b0e63606ed7bf0aa,10.25,41
"SFU E Com Assorted Chocolate Gift Hamper | Chocolate Gift For Birthday, Anniversary, Valentine, Diwali, Rakhi, New Year | 011",319.0,https://www.amazon.in/dp/B0CSWPL8DY,amazon,3.2,,,INR,319.0,319.0,319.0,"SFU E Com Assorted Chocolate Gift Hamper | Chocolate Gift For Birthday, Anniversary, Valentine, Diwali, Rakhi, New Year | 011",,ffb91c1ef78c4f87aa42eaa696770ed4,10.03,42
WINNI - Luxury 12 Pcs Truffle Chocolates Gift Pack | Belgian Dark Chocolates Gift | Handmade Celebration Chocolate Gift Bo...,499.0,https://www.amazon.in/dp/B0GPD5GZ6W,amazon,5.0,,,INR,499.0,499.0,499.0,WINNI - Luxury 12 Pcs Truffle Chocolates Gift Pack | Belgian Dark Chocolates Gift | Handmade Celebration Chocolate Gift Bo...,,5bc7dd8ecd4323f06be79719df484ac0,10.02,43
WINNI - Super Luxury 2 Bar Pack + 9 Pcs Truffle Chocolate Gift | Belgian Dark Chocolates | Imported Chocolates | Celebrati...,499.0,https://www.amazon.in/dp/B0GMWYKDLM,amazon,5.0,,,INR,499.0,499.0,499.0,WINNI - Luxury 2 Bar Pack + 9 Pcs Truffle Chocolate Gift | Belgian Dark Chocolates | Imported Chocolates | Celebrati...,,f45005af27c5823ad71c350afd2be127,10.02,44
WINNI - Luxury Imported 12 Pcs Truffle Chocolate Gift Pack | Belgian Dark Chocolates Gift | Premium Handmade Chocolates Gi...,499.0,https://www.amazon.in/dp/B0GSQ9JTW9,amazon,5.0,,,INR,499.0,499.0,499.0,WINNI - Luxury Imported 12 Pcs Truffle Chocolate Gift Pack | Belgian Dark Chocolates Gift | Premium Handmade Chocolates Gi...,,35dd81972243fa6f7c68603ae6bb322e,10.02,45
WINNI - Luxury 12 Pcs Belgian Truffle Chocolates Gift Pack | Imported Dark Chocolates Pack | Handmade Celebration Chocolat...,499.0,https://www.amazon.in/dp/B0GQ9549MY,amazon,5.0,,,INR,499.0,499.0,499.0,WINNI - Luxury 12 Pcs Belgian Truffle Chocolates Gift Pack | Imported Dark Chocolates Pack | Handmade Celebration Chocolat...,,8120c9ea3fe394a5040b91b384695480,10.02,46
ZOROY Luxury Chocolate Vegan Dark Gluten Free Purist Collection Craft Bean to Bar Single Origin Chocolate Bar Pack of 2 x ...,430.0,https://www.amazon.in/dp/B07SJFKZYF,amazon,4.1,,,INR,430.0,430.0,430.0,ZOROY Luxury Chocolate Vegan Dark Gluten Free Purist Collection Craft Bean to Bar Single Origin Chocolate Bar Pack of 2 x ...,,ece6c1dab4e472ef1b89439b7db445c0,9.53,47
Lindt Exotic Milk Truffles Chocolate Gift Box - 200 Grams Pack,849.0,https://www.amazon.in/dp/B0120JMATC,amazon,4.0,,200.0,INR,849.0,849.0,849.0,Lindt Exotic Milk Truffles Chocolate Gift Box - 200 Grams Pack,4.25,a29b2a2a490af9bda3a3c7b81e458e78,9.41,48
WINNI - 3 Pack Deluxe Chocolate Bar Gift Hamper | Premium Choco Bars Gift Pack | Belgian Dark Chocolates Gift | Chocolate ...,499.0,https://www.amazon.in/dp/B0CNSWFM2D,amazon,4.4,,,INR,499.0,499.0,499.0,WINNI - 3 Pack Deluxe Chocolate Bar Gift Hamper | Premium Choco Bars Gift Pack | Belgian Dark Chocolates Gift | Chocolate ...,,9ce851d72dea4bc92df2ba888d136c67,8.82,49
WINNI - Deluxe Imported 12 Pcs Truffle Chocolate Gift Pack | Belgian Dark Chocolates Gift | Premium Handmade Chocolates Gi...,499.0,https://www.amazon.in/dp/B0G6YG8H8H,amazon,4.4,,,INR,499.0,499.0,499.0,WINNI - Deluxe Imported 12 Pcs Truffle Chocolate Gift Pack | Belgian Dark Chocolates Gift | Premium Handmade Chocolates Gi...,,3ef26750815f1f20e0db215abf599bb2,8.82,50
"Dalmond Truffles Handmade Almond Date Chocolates Gift Box and Chocolates Gift Pack -12 Pcs, Assorted - Dark, Milk & White ...",499.0,https://www.amazon.in/dp/B0854D68PX,amazon,4.2,,,INR,499.0,499.0,499.0,"Dalmond Truffles Handmade Almond Date Chocolates Gift Box and Chocolates Gift Pack -12 Pcs, Assorted - Dark, Milk & White ...",,c6056d0971b5f7f85b03cddb4b99ca4b,8.42,51
"SMOOR Luxe Treat Box of 16 | Premium Assorted Chocolate Gift Box for Celebration, Wedding, Birthday, Anniversary, Gifting,...",540.0,https://www.amazon.in/dp/B0FP2PQMH3,amazon,4.5,,,INR,540.0,540.0,540.0,"SMOOR Luxe Treat Box of 16 | Premium Assorted Chocolate Gift Box for Celebration, Wedding, Birthday, Anniversary, Gifting,...",,2202368efdf5b49b1e61f4e5e756117c,8.33,52
CookieMan Premium Chocolate Gift Pack | 25 Piece Chocolate Pack filled with Hazelnut Strawberry English Toffee | Luxury Ch...,584.0,https://www.amazon.in/dp/B0DHX5RLJV,amazon,4.8,,,INR,584.0,584.0,584.0,CookieMan Premium Chocolate Gift Pack | 25 Piece Chocolate Pack filled with Hazelnut Strawberry English Toffee | Luxury Ch...,,0701b9a9287ae145cf0b9bfe9aa9705f,8.22,53
"Astonished Retail Astonished Lovely Surprise for Birthday Boy and Birthday Girl | Chocolate Gift Hamper for Diwali, Birthd...",499.0,https://www.amazon.in/dp/B08L1V5DBX,amazon,4.0,,,INR,499.0,499.0,499.0,"Astonished Retail Astonished Lovely Surprise for Birthday Boy and Birthday Girl | Chocolate Gift Hamper for Diwali, Birthd...",,0016dbddec9b67176fc166b0083e59c2,8.02,54
"Ferrero Collection Premium Assorted Chocolates Gift Box 269g By COUGAR | Includes Ferrero Rocher, Raffaello & Dark Chocola...",1696.0,https://www.amazon.in/dp/B0GJT3YBXC,amazon,5.0,,269.0,INR,1696.0,1696.0,1696.0,"Ferrero Collection Premium Assorted Chocolates Gift Box 269g By COUGAR | Includes Ferrero Rocher, Raffaello & Dark Chocola...",6.3,cc52813c50583946f7c24d9415a32ca0,7.94,55
"SFU E Com Assorted Chocolate Gift Hamper | Chocolate Gift For Birthday, Anniversary, Valentine, Diwali, Rakhi, New Year | ...",419.0,https://www.amazon.in/dp/B0CSWPX6SM,amazon,3.3,,,INR,419.0,419.0,419.0,"SFU E Com Assorted Chocolate Gift Hamper | Chocolate Gift For Birthday, Anniversary, Valentine, Diwali, Rakhi, New Year | ...",,193af4cf1d26d7823f610ef7b7fe039f,7.88,56
Chokola Signature Dessert Square Chocolate Hamper – Premium Sponge Cake Enrobed in Dark Chocolate (Brownie) with Assorted ...,600.0,https://www.amazon.in/dp/B0FQTW7YTH,amazon,4.6,,,INR,600.0,600.0,600.0,Chokola Signature Dessert Square Chocolate Hamper – Premium Sponge Cake Enrobed in Dark Chocolate (Brownie) with Assorted ...,,9b001082bcb99bd922708bce30c1bb41,7.67,57
"Astonished Retail Chocolate Gift Hamper with Metal Cart Basket | Chocolate Gift Hamper for Diwali, Birthday, Holi, Rakhi, ...",549.0,https://www.amazon.in/dp/B08L1V54CB,amazon,4.1,,,INR,549.0,549.0,549.0,"Astonished Retail Chocolate Gift Hamper with Metal Cart Basket | Chocolate Gift Hamper for Diwali, Birthday, Holi, Rakhi, ...",,342a8dd60efa364f983b058f211d4ba8,7.47,58
"Rakhi Gift Set for Brother & Bhabhi,Men,Adult,Younger,Elder Brother – 4 Rakhi Combo with Handmade Chocolates, Almonds & Ti...",679.0,https://www.amazon.in/dp/B0FHBHCMBC,amazon,5.0,,,INR,679.0,679.0,679.0,"Rakhi Gift Set for Brother & Bhabhi,Men,Adult,Younger,Elder Brother – 4 Rakhi Combo with Handmade Chocolates, Almonds & Ti...",,4ad807fa45271c9b94ca9b8921d05b4c,7.36,59
"Omay Foods 6 Pcs Wonderful Delights Healthy Gift Hamper | Snacks, Chocolate & Potpourri | Corporate Gift for Clients & Emp...",516.0,https://www.amazon.in/dp/B08ZB5FQVM,amazon,3.8,,,INR,516.0,516.0,516.0,"Omay Foods 6 Pcs Wonderful Delights Healthy Gift Hamper | Snacks, Chocolate & Potpourri | Corporate Gift for Clients & Emp...",,414342da3a20de1938c234e401651b08,7.36,60
EAT BETTER CO Anmol Rakhi Gift Hamper - 7 Items Combo Pack - Chocolate Coated Almonds & Cashews - Four packets of Dry Frui...,599.0,https://www.amazon.in/dp/B0C61CNDD6,amazon,4.3,,,INR,599.0,599.0,599.0,EAT BETTER CO Anmol Rakhi Gift Hamper - 7 Items Combo Pack - Chocolate Coated Almonds & Cashews - Four packets of Dry Frui...,,163456f568f0638a676abfb342ee59ff,7.18,61
"Urban Festivities Rakhi Gift Combo for Brother | 3 Rakhis with 100g Cashews, 100g Almonds & 3 Chocolates | Raksha Bandhan ...",499.0,https://www.amazon.in/dp/B0DBJ2YKK2,amazon,3.5,,100.0,INR,499.0,499.0,499.0,"Urban Festivities Rakhi Gift Combo for Brother | 3 Rakhis with 100g Cashews, 100g Almonds & 3 Chocolates | Raksha Bandhan ...",4.99,bbfe6eeccf997a8044e596b2687b378a,7.01,62
"SMOOR Assorted Chocolate Thins, Premium Gift Pack of 25, Gourmet Selection | Perfect for Wedding, Birthday, Anniversary, G...",601.0,https://www.amazon.in/dp/B0FMY4GLYG,amazon,4.2,,,INR,601.0,601.0,601.0,"SMOOR Assorted Chocolate Thins, Premium Gift Pack of 25, Gourmet Selection | Perfect for Wedding, Birthday, Anniversary, G...",,19190eeefafef54b57017114405000c6,6.99,63
"Astonished Retail Astonished Dairy Milk Silk Flavored Chocolates with Handmade Basket | Chocolate Gift Hamper for Diwali, ...",619.0,https://www.amazon.in/dp/B08L1S39MF,amazon,4.3,,,INR,619.0,619.0,619.0,"Astonished Retail Astonished Dairy Milk Silk Flavored Chocolates with Handmade Basket | Chocolate Gift Hamper for Diwali, ...",,a7724ccddbff0ff484073bbd821cf448,6.95,64
"SMOOR Premium Celebration Box of 20 | Chocolates Gift Pack Gifting best for Wedding, Birthday, Anniversary, Gifting & Snac...",616.0,https://www.amazon.in/dp/B08QPWK7LV,amazon,4.2,,,INR,616.0,616.0,616.0,"SMOOR Premium Celebration Box of 20 | Chocolates Gift Pack Gifting best for Wedding, Birthday, Anniversary, Gifting & Snac...",,9dcf9e6020c9c3d137292720fb06e0d8,6.82,65
Food Essential Chocolate Gift Hamper Basket for Family/Friend/Corporate/Wedding/Diwali/Christmas/New Year/Bhai Dooj/Rakhi...,654.0,https://www.amazon.in/dp/B0CNRXL7SW,amazon,3.7,,,INR,654.0,654.0,654.0,Food Essential Chocolate Gift Hamper Basket for Family/Friend/Corporate/Wedding/Diwali/Christmas/New Year/Bhai Dooj/Rakhi...,,2bc10f92e7d04a4ad0d726ad8380bde5,5.66,66
TABS Dark Chocolate For Men & Women I Chocolate Gift Box For Husband & wife I Valentine Gift Set For Boyfriend & Girlfrien...,615.0,https://www.amazon.in/dp/B0DYF554X6,amazon,3.4,,,INR,615.0,615.0,615.0,TABS Dark Chocolate For Men & Women I Chocolate Gift Box For Husband & wife I Valentine Gift Set For Boyfriend & Girlfrien...,,d3c5f205306a46d07f4d3802bcfb7756,5.53,67
WINNI - Luxury 24 Pcs Truffle Chocolates Gift Pack | Belgian Dark Chocolates Gift | Handmade Celebration Chocolate Gift Bo...,899.0,https://www.amazon.in/dp/B0GSQCF6G1,amazon,4.7,,,INR,899.0,899.0,899.0,WINNI - Luxury 24 Pcs Truffle Chocolates Gift Pack | Belgian Dark Chocolates Gift | Handmade Celebration Chocolate Gift Bo...,,bc03950d1164bbbdb5edb85fc02d4f0d,5.23,68
Lindt Lindor Assorted Chocolate Truffle Gift Box 200-Gm,794.0,https://www.amazon.in/dp/B07WZLKRV1,amazon,4.1,,,INR,794.0,794.0,794.0,Lindt Lindor Assorted Chocolate Truffle Gift Box 200-Gm,,a6f359e18843e906f7cf6c120595639d,5.16,69
WINNI - Luxury 24 Pcs Hazelnut Chocolates Gift Pack | Belgian Dark Chocolates Gift Box | Handmade Celebration Chocolate Gi...,999.0,https://www.amazon.in/dp/B0GVHX67FX,amazon,5.0,,,INR,999.0,999.0,999.0,WINNI - Luxury 24 Pcs Hazelnut Chocolates Gift Pack | Belgian Dark Chocolates Gift Box | Handmade Celebration Chocolate Gi...,,b4c17eef978937aae07c135dea8727fd,5.01,70
WINNI - Premium 24 Pcs Hazelnut Chocolates Gift Pack | Belgian Dark Chocolates Gift | Handmade Celebration Chocolate Gift ...,999.0,https://www.amazon.in/dp/B0GPH2RS7C,amazon,5.0,,,INR,999.0,999.0,999.0,WINNI - Premium 24 Pcs Hazelnut Chocolates Gift Pack | Belgian Dark Chocolates Gift | Handmade Celebration Chocolate Gift ...,,8d672275f39542a559127886fb955cce,5.01,71
